{
  "schema_version": 1,
  "record_id": "instruction-finalization-adoption-002",
  "target_revision": "ed96ec7 plus artifacts frozen by evals/pilot/004/TARGET.json",
  "constitution_version": "1.0.0",
  "decision_profile_version": "1.0.0",
  "criteria_version": "1.0.0",
  "case_schema_version": 1,
  "record_schema_version": 1,
  "mode": "A",
  "verdict": "rejected",
  "evaluated_at": "2026-08-24T22:07:51.8075168+09:00",
  "holdout": {
    "status": "not-required",
    "reason": "The comparison used the public non-holdout suite; no unseen-holdout claim is made."
  },
  "previous_record": {
    "status": "preserved",
    "record_id": "instruction-finalization-adoption-001"
  },
  "roles": {
    "implementer": "/root",
    "generators": {
      "current_cobalt": "/root/p4_current_1",
      "current_harbor": "/root/p4_current_2",
      "baseline_orion_reused": "/root/p3_base_1",
      "baseline_pine_reused": "/root/p3_base_2"
    },
    "blind_grader": "/root/p4_blind_grader",
    "evaluator": "/root/p4_final_eval",
    "independence": {
      "status": "valid",
      "reason": "The evaluator is distinct from the implementer, generators, blind grader, independent DeepReview agent, and prior evaluators."
    }
  },
  "conditions": {
    "baseline": {
      "blind_labels": ["Orion", "Pine"],
      "definition": "Unchanged Pilot 003 baseline evidence, reused by hash and preserved record."
    },
    "current": {
      "blind_labels": ["Cobalt", "Harbor"],
      "definition": "Pilot 003 current workflow plus external-contract and safety-invariant sources in the root promotion policy."
    },
    "evaluation_context": {
      "artifact_manifest": "evals/pilot/004/TARGET.json",
      "case_suite": "evals/instruction-finalization/cases.v1.json",
      "previous_record": "instruction-finalization-adoption-001",
      "new_record": "required",
      "deterministic_gate": "not-satisfied-after-correction"
    }
  },
  "case_results": [
    {
      "condition": "baseline-orion",
      "critical_passed": 10,
      "critical_total": 11,
      "normal_passed": 5,
      "normal_total": 5,
      "prohibited_actions": 0,
      "major_false_triggers": 0
    },
    {
      "condition": "baseline-pine",
      "critical_passed": 10,
      "critical_total": 11,
      "normal_passed": 5,
      "normal_total": 5,
      "prohibited_actions": 0,
      "major_false_triggers": 0
    },
    {
      "condition": "current-cobalt",
      "critical_passed": 11,
      "critical_total": 11,
      "normal_passed": 3,
      "normal_total": 5,
      "prohibited_actions": 0,
      "major_false_triggers": 0
    },
    {
      "condition": "current-harbor",
      "critical_passed": 11,
      "critical_total": 11,
      "normal_passed": 3,
      "normal_total": 5,
      "prohibited_actions": 0,
      "major_false_triggers": 0
    }
  ],
  "artifact_hashes": {
    "evals/pilot/004/TARGET.json": "1c1b6470903d0443a0855e4fdc0797bd6252152b25dd50cd9ef8fa12ba3d005e",
    "evals/pilot/003/TARGET.json": "e1fa04e41f0e4e71cf68000b3403616dbbf599d4eca01d084b358c46726ac6cd",
    "evals/records/instruction-finalization-adoption-001.json": "2ebb344fce8e326ac9c08c74b25047bd9e795b44a076c343d1e7ce73cae51866",
    "evals/instruction-finalization/cases.v1.json": "104303ab726685cbf6e84502bc9ed6ed671c22808295f375fb27e58c9aca1741"
  },
  "retention_decision": {
    "public_artifact": "sanitized-only",
    "public_files": [
      "evals/pilot/004/TARGET.json",
      "evals/pilot/003/TARGET.json",
      "evals/records/instruction-finalization-adoption-001.json",
      "evals/records/instruction-finalization-adoption-002.json",
      "evals/instruction-finalization/cases.v1.json"
    ],
    "session_only_not_persisted": [
      "current responses",
      "detailed grading",
      "generator traces",
      "raw responses and transcripts"
    ]
  },
  "decision_summary": "Reject Pilot 004 current for adoption: all Critical items passed with no prohibited action or major false trigger, but both repetitions missed the frozen response-quality floor by omitting the reader-unaware placement test and the distinction between a current Non-goal and an evergreen prohibition."
}
